{
  "$schema": "./section-registry.schema.json",
  "version": "1.0.0",
  "description": "Single source of truth for all OSI Cards section types",
  "sections": {
    "info": {
      "name": "Info Section",
      "description": "Displays key-value pairs in a clean, scannable format. Ideal for metadata, contact information, and general data display.",
      "componentPath": "./lib/components/sections/info-section.component",
      "stylePath": "./lib/styles/components/sections/_info.scss",
      "selector": "app-info-section",
      "useCases": [
        "Company information",
        "Contact details",
        "Metadata display",
        "Key-value pairs"
      ],
      "bestPractices": [
        "Use for structured data with clear labels and values",
        "Keep labels concise and descriptive",
        "Use trend indicators for dynamic data",
        "Group related fields together"
      ],
      "rendering": {
        "usesFields": true,
        "usesItems": false,
        "defaultColumns": 1,
        "supportsCollapse": true,
        "supportsEmoji": true
      },
      "fieldSchema": {
        "type": "object",
        "properties": {
          "label": { "type": "string", "description": "Field label/key" },
          "value": { "type": ["string", "number", "boolean", "null"], "description": "Field value" },
          "icon": { "type": "string", "description": "Icon identifier (emoji or icon name)" },
          "description": { "type": "string", "description": "Additional field description" },
          "trend": { "type": "string", "enum": ["up", "down", "stable", "neutral"], "description": "Trend indicator" },
          "change": { "type": "number", "description": "Numeric change value" },
          "format": { "type": "string", "enum": ["currency", "percentage", "number", "text"], "description": "Value format" }
        },
        "required": ["label"]
      },
      "testFixtures": {
        "complete": {
          "title": "Company Information",
          "type": "info",
          "description": "Detailed company information and metadata",
          "fields": [
            { "label": "Industry", "value": "Technology", "icon": "üè¢" },
            { "label": "Founded", "value": "2010", "icon": "üìÖ" },
            { "label": "Headquarters", "value": "San Francisco, CA", "icon": "üìç" },
            { "label": "Employees", "value": "5,000+", "icon": "üë•", "trend": "up" },
            { "label": "Website", "value": "www.example.com", "icon": "üåê" }
          ]
        },
        "minimal": {
          "title": "Info",
          "type": "info",
          "fields": [{ "label": "Key", "value": "Value" }]
        },
        "edgeCases": {
          "title": "Info Section with Very Long Title That Should Be Truncated Properly",
          "type": "info",
          "fields": [
            { "label": "Empty Value", "value": "" },
            { "label": "Null Value", "value": null },
            { "label": "Number", "value": 12345.6789 },
            { "label": "Boolean", "value": true }
          ]
        }
      }
    },
    "analytics": {
      "name": "Analytics Section",
      "description": "Displays metrics with visual indicators, trends, and percentages. Perfect for KPIs, performance metrics, and statistical data.",
      "componentPath": "./lib/components/sections/analytics-section/analytics-section.component",
      "stylePath": "./lib/styles/components/sections/_analytics.scss",
      "selector": "app-analytics-section",
      "useCases": [
        "Performance metrics",
        "KPIs",
        "Growth statistics",
        "Analytics dashboards"
      ],
      "bestPractices": [
        "Include percentage values for better visualization",
        "Use trend indicators (up/down/stable)",
        "Show change values when available",
        "Group related metrics together"
      ],
      "rendering": {
        "usesFields": true,
        "usesItems": false,
        "defaultColumns": 2,
        "supportsCollapse": true,
        "supportsEmoji": true
      },
      "fieldSchema": {
        "type": "object",
        "properties": {
          "label": { "type": "string", "description": "Metric label" },
          "value": { "type": ["string", "number"], "description": "Metric value" },
          "percentage": { "type": "number", "description": "Percentage value for visualization" },
          "performance": { "type": "string", "enum": ["excellent", "good", "average", "poor"], "description": "Performance rating" },
          "trend": { "type": "string", "enum": ["up", "down", "stable", "neutral"], "description": "Trend indicator" },
          "change": { "type": "number", "description": "Numeric change value" },
          "icon": { "type": "string", "description": "Icon identifier" }
        },
        "required": ["label"]
      },
      "aliases": ["metrics", "stats"],
      "testFixtures": {
        "complete": {
          "title": "Performance Analytics",
          "type": "analytics",
          "description": "Key performance indicators and metrics",
          "fields": [
            { "label": "Performance Score", "value": "95%", "percentage": 95, "performance": "excellent", "trend": "up", "change": 5.2 },
            { "label": "Growth Rate", "value": "25% YoY", "percentage": 25, "performance": "good", "trend": "up", "change": 8.1 },
            { "label": "Market Share", "value": "12%", "percentage": 12, "performance": "average", "trend": "stable", "change": 0.5 },
            { "label": "Customer Satisfaction", "value": "4.8/5", "percentage": 96, "performance": "excellent", "trend": "up" }
          ]
        },
        "minimal": {
          "title": "Analytics",
          "type": "analytics",
          "fields": [{ "label": "Score", "value": "100%", "percentage": 100 }]
        },
        "edgeCases": {
          "title": "Analytics Edge Cases",
          "type": "analytics",
          "fields": [
            { "label": "Zero", "value": "0%", "percentage": 0, "trend": "down", "change": -100 },
            { "label": "Negative", "value": "-15%", "percentage": -15, "performance": "poor", "trend": "down" },
            { "label": "Max", "value": "100%", "percentage": 100, "trend": "up", "change": 999.99 }
          ]
        }
      }
    },
    "contact-card": {
      "name": "Contact Card Section",
      "description": "Displays person information with avatars, roles, contact details, and social links.",
      "componentPath": "./lib/components/sections/contact-card-section/contact-card-section.component",
      "stylePath": "./lib/styles/components/sections/_contact.scss",
      "selector": "app-contact-card-section",
      "useCases": [
        "Team members",
        "Key contacts",
        "Leadership",
        "Stakeholders"
      ],
      "bestPractices": [
        "Include name, role, and contact info",
        "Add avatar images when available",
        "Include social media links",
        "Group by department or role"
      ],
      "rendering": {
        "usesFields": true,
        "usesItems": false,
        "defaultColumns": 2,
        "supportsCollapse": true,
        "supportsEmoji": false
      },
      "fieldSchema": {
        "type": "object",
        "properties": {
          "title": { "type": "string", "description": "Contact name" },
          "label": { "type": "string", "description": "Contact label" },
          "value": { "type": "string", "description": "Role or description" },
          "role": { "type": "string", "description": "Job role/title" },
          "email": { "type": "string", "format": "email", "description": "Email address" },
          "phone": { "type": "string", "description": "Phone number" },
          "avatar": { "type": "string", "description": "Avatar image URL" },
          "department": { "type": "string", "description": "Department name" },
          "linkedIn": { "type": "string", "format": "uri", "description": "LinkedIn profile URL" }
        },
        "required": []
      },
      "testFixtures": {
        "complete": {
          "title": "Key Contacts",
          "type": "contact-card",
          "description": "Primary contacts and stakeholders",
          "fields": [
            {
              "label": "Primary Contact",
              "title": "Jane Doe",
              "value": "Product Manager",
              "email": "jane.doe@example.com",
              "phone": "+1 555 0100",
              "role": "Product Manager",
              "department": "Product",
              "linkedIn": "https://linkedin.com/in/janedoe"
            },
            {
              "label": "Technical Lead",
              "title": "John Smith",
              "value": "Engineering Director",
              "email": "john.smith@example.com",
              "phone": "+1 555 0101",
              "role": "Engineering Director",
              "department": "Engineering"
            }
          ]
        },
        "minimal": {
          "title": "Contact",
          "type": "contact-card",
          "fields": [{ "title": "Contact Name", "email": "contact@example.com" }]
        },
        "edgeCases": {
          "title": "Contact Edge Cases",
          "type": "contact-card",
          "fields": [
            { "title": "No Email", "value": "No contact info available" },
            { "title": "Long Name That Exceeds Normal Display Width", "email": "very.long.email@subdomain.domain.example.com" }
          ]
        }
      }
    },
    "network-card": {
      "name": "Network Card Section",
      "description": "Displays relationship graphs, network connections, and influence metrics.",
      "componentPath": "./lib/components/sections/network-card-section/network-card-section.component",
      "stylePath": "./lib/styles/components/sections/_network.scss",
      "selector": "app-network-card-section",
      "useCases": [
        "Org charts",
        "Relationship maps",
        "Network analysis",
        "Connection graphs"
      ],